video_id,title,keyword,keyword_zh,school_slug,school_zh,township_slug,sentence_1,sentence_1_zh,sentence_2,sentence_2_zh,youtube
8IHlVTgQJR8,Word of the Day: recorder (n) 直笛,recorder (n),直笛,kuaiguan,彰化縣彰化市快官國小,changhua-city,The recorder is the first musical instrument that many students learn.,直笛是很多學生學的第一項樂器。,You can play many songs on a recorder.,你可以用直笛吹奏很多歌曲。,https://www.youtube.com/watch?v=8IHlVTgQJR8
J3Ws9zxJPJo,Word of the Day: relay race 接力賽,relay race,接力賽,lushang,彰化縣芳苑鄉路上國小,fangyuan,"In the relay race, students pass their batons to the next runners.",在接力賽中，同學們把接力棒遞給下一棒。,The relay race is a very exciting event.,接力賽是一項非常刺激的比賽。,https://www.youtube.com/watch?v=J3Ws9zxJPJo
8KmdtQmL6Xo,Word of the Day: Mother's Day card 母親節卡,Mother's Day card,母親節卡,raoming,彰化縣員林市饒明國小,yuanlin-city,These students are making Mother's Day cards for their mothers.,這些學生正在為他們的母親製作母親節卡片。,They draw pictures and put a message on their Mother's Day cards.,他們畫畫並在母親節卡片上留言。,https://www.youtube.com/watch?v=8KmdtQmL6Xo
k-hb1DmIHXo,Word of the Day: wash your hands 洗手,wash your hands,洗手,santiao,彰化縣溪州鄉三條國小,xizhou,It's important to wash your hands after using the bathroom.,上完廁所後洗手是很重要的。,Make sure to wash your hands with soap and water before eating.,確定在吃東西之前要用香皂和水來洗手。,https://www.youtube.com/watch?v=k-hb1DmIHXo
gXswsPUZjI4,Word of the Day: HIV AIDS 愛滋病毒/愛滋病,HIV AIDS,愛滋病毒/愛滋病,lushang,彰化縣芳苑鄉路上國小,fangyuan,Students go to the auditorium to learn about HIV/AIDS.,同學們到禮堂聽取有關HIV病毒與愛滋病的知識。,They learn about HIV/AIDS for health education.,學習HIV病毒與愛滋病相關知識是他們健康教育的一部份。,https://www.youtube.com/watch?v=gXswsPUZjI4
pNxeQrlpubs,Word of the Day: CPR 心肺復甦術,CPR,心肺復甦術,jhutang,彰化縣竹塘鄉竹塘國小,zhutang,CPR is a procedure that can save someone's life if their heart stops beating.,心肺復甦術是種醫療處理，當有人心臟停止跳動時可以用它來救人一命。,"CPR isn't only useful for adults to learn; kids can learn and perform CPR, too.",心肺復甦術不僅對大人很有用，小孩子也可以學習做CPR。,https://www.youtube.com/watch?v=pNxeQrlpubs
l3Jft0if59o,Word of the Day: professional development 專業進修,professional development,專業進修,changsing,彰化縣彰化市彰興國中,changhua-city,"In Taiwan, all schools have professional development sessions for teachers.",在台灣，所有學校都有教師專業訓練課程。,Teachers learn new skills and strategies during their professional development sessions.,在專業訓練課程中，老師可以學到新的教學技巧與策略。,https://www.youtube.com/watch?v=l3Jft0if59o
gQw2NNuh8xk,Word of the Day: distance learning 遠距學習,distance learning,遠距學習,nanya,彰化縣社頭鄉湳雅國小,shetou,The students participate in a distance learning program.,學生參加遠距學習計畫。,"In the distance learning program, the students focus on learning English.",在遠距學習計畫中，學生專注於學習英語。,https://www.youtube.com/watch?v=gQw2NNuh8xk
Pu-hg_5uh08,Word of the Day: scissors (n) 剪刀,scissors (n),剪刀,lushang,彰化縣芳苑鄉路上國小,fangyuan,Students use scissors to cut paper,學生用剪刀剪紙,Scissors are a helpful classroom tool,剪刀是有用的課堂工具,https://www.youtube.com/watch?v=Pu-hg_5uh08
_ds3r2KxUH4,Word of the Day: recite (v) 背誦,recite (v),背誦,lushang,彰化縣芳苑鄉路上國小,fangyuan,The students recite words and sentences in English.,同學們背誦英文單字與句子。,The teacher checks to make sure the students are reciting the words correctly.,老師檢查並確認學生們是否有正確背誦英文單字。,https://www.youtube.com/watch?v=_ds3r2KxUH4
vt-Io3ZbT3s,Word of the Day: Mother's Day 母親節,Mother's Day,母親節,wenkai,彰化縣鹿港鎮文開國小,lukang,The school hosts special performances in honor of Mother's Day.,學校舉辦特別表演以慶祝母親節。,The performance provides a special way for students to express their love and gratitude on Mother's Day.,該表演為學生在母親節表達愛和感激之情提供了一種特殊的方式。,https://www.youtube.com/watch?v=vt-Io3ZbT3s
fesJdozweNE,Word of the Day: bake (v) 烘焙,bake (v),烘焙,mingli,彰化縣田中鎮明禮國小,tianzhong,The students are learning how to bake.,學生們正在學習如何烘烤。,You can make sweet treats by baking.,你可以通過烘烤來製作甜點,https://www.youtube.com/watch?v=fesJdozweNE
zmbpmEmgNwg,Word of the Day: cycling (n) 騎自行車,cycling (n),騎自行車,nanya,彰化縣社頭鄉湳雅國小,shetou,Cycling is a healthy physical activity.,騎自行車是一項健康的體育活動。,The students experience cycling in the countryside.,學生們在鄉村體驗騎自行車。,https://www.youtube.com/watch?v=zmbpmEmgNwg
PaWeq5pa-RM,Word of the Day: Mother's Day 母親節,Mother's Day,母親節,fangyuan,彰化縣芳苑鄉芳苑國小,fangyuan,The school hosts special performances in honor of Mother's Day.,學校舉辦特別表演以慶祝母親節。,The performance provides a special way for students to express their love and gratitude on Mother's Day.,該表演為學生在母親節表達愛和感激之情提供了一種特殊的方式。,https://www.youtube.com/watch?v=PaWeq5pa-RM
NyfsWBj5isk,Word of the Day: Mother's Day (n) 母親節,Mother's Day (n),母親節,chungshan,彰化縣彰化市中山國小,changhua-city,The students are making Mother’s Day cards.,學生們正在製作母親節卡片。,They are drawing pictures and writing messages to show their love for Mom on Mother’s Day.,他們在母親節畫畫、寫信表達對媽媽的愛。,https://www.youtube.com/watch?v=NyfsWBj5isk
nuT6_5Alldg,Word of the Day: recorder (n) 直笛,recorder (n),直笛,pinghe,彰化縣彰化市平和國小,changhua-city,The recorder is the first musical instrument that many students learn.,直笛是很多學生學的第一項樂器。,You can play many songs on a recorder.,你可以用直笛吹奏很多歌曲。,https://www.youtube.com/watch?v=nuT6_5Alldg
IcqRwtytKpY,Word of the Day: computer class (n) 電腦課,computer class (n),電腦課,pinghe,彰化縣彰化市平和國小,changhua-city,The students learn how to use computers in computer class.,同學們在電腦課中學習如何使用電腦。,Each student uses a computer during computer class.,每個學生在電腦課的時候都有一台電腦可以使用。,https://www.youtube.com/watch?v=IcqRwtytKpY
VdmZGysrxNI,Word of the Day: basketball (n) 籃球,basketball (n),籃球,pinghe,彰化縣彰化市平和國小,changhua-city,The students play basketball outside.,同學們在外面打籃球。,They shoot the ball when playing basketball.,他們在打籃球的時候投籃。,https://www.youtube.com/watch?v=VdmZGysrxNI
zp9JSUUnjuU,Word of the Day: farm (v) 種植、耕作,farm (v),種植、耕作,mingli,彰化縣田中鎮明禮國小,tianzhong,The students learn about farming at school.,學生們在學校學習農業耕作的知識。,The school has land to farm different crops.,學校有土地可以種植不同的作物。,https://www.youtube.com/watch?v=zp9JSUUnjuU
aSvV4qgFpPc,Word of the Day: professional development (n) 專業進修,professional development (n),專業進修,pinghe,彰化縣彰化市平和國小,changhua-city,"In Taiwan, all schools have professional development sessions for teachers.",在台灣，所有學校都有教師專業訓練課程。,Teachers learn new skills and strategies during their professional development sessions.,在專業訓練課程中，老師可以學到新的教學技巧與策略。,https://www.youtube.com/watch?v=aSvV4qgFpPc
Ly_2mN4nR8I,Word of the Day: climbing trees 爬樹,climbing trees,爬樹,xishi,彰化縣福興鄉西勢國小,fuxing,The students use special equipment to climb trees.,學生們使用特殊設備爬樹。,The instructors teach students how to climb the tree safely.,指導員教學生如何安全地爬樹。,https://www.youtube.com/watch?v=Ly_2mN4nR8I
fkBktbuRXr4,Word of the Day: calligraphy (n) 書法,calligraphy (n),書法,renfeng,彰化縣田尾鄉仁豐國小,tianwei,The boys and girls are learning traditional Chinese calligraphy.,這群男孩和女孩正在學習中國傳統的書法。,"To get good at calligraphy, you have to have a lot of patience!",書法要寫得好必須要很有耐心。,https://www.youtube.com/watch?v=fkBktbuRXr4
66lyCQ8dcHg,Word of the Day: basketball (n)籃球,basketball (n),籃球,renfeng,彰化縣田尾鄉仁豐國小,tianwei,The students play basketball outside.,同學們在外面打籃球。,They shoot the ball when playing basketball.,他們在打籃球的時候投籃。,https://www.youtube.com/watch?v=66lyCQ8dcHg
2Xv8D6VqSZQ,Word of the Day: Chinese flute (n) 笛子,Chinese flute (n),笛子,mingli,彰化縣田中鎮明禮國小,tianzhong,The Chinese flute is a woodwind instrument.,笛子是一種木管樂器。,"To play the Chinese flute, you need good breath control and the right finger positions.",吹奏笛子需要良好的氣息控制和正確的手指位置。,https://www.youtube.com/watch?v=2Xv8D6VqSZQ
3GFprPc17cs,Word of the Day: watercolor (n) 水彩,watercolor (n),水彩,kuaiguan,彰化縣彰化市快官國小,changhua-city,"In art class, the students are painting with watercolor.",學生們在美術課用水彩畫畫。,"To use watercolor, you need a brush, a palette and water.",用水彩繪畫時，你需要畫筆、調色盤還有水。,https://www.youtube.com/watch?v=3GFprPc17cs
MPNtsCIyAj0,Word of the Day: recess  (n) 下課時間,recess  (n),下課時間,renfeng,彰化縣田尾鄉仁豐國小,tianwei,"After the bell rings for recess, most students go outside to play.",下課鈴聲響起後，大多數學生都在外面玩。,"Recess is when kids can play outside, run around, and have fun.",下課時間是孩子們可以在外面玩耍、跑來跑去、玩得開心的時候。,https://www.youtube.com/watch?v=MPNtsCIyAj0
hk6iVT43djo,Word of the Day: professional development (n) 專業進修,professional development (n),專業進修,renfeng,彰化縣田尾鄉仁豐國小,tianwei,"In Taiwan, all schools have professional development sessions for teachers.",在台灣，所有學校都有教師專業訓練課程。,Teachers learn new skills and strategies during their professional development sessions.,在專業訓練課程中，老師可以學到新的教學技巧與策略。,https://www.youtube.com/watch?v=hk6iVT43djo
is_HjlFocro,Word of the Day: go over 複習、檢討,go over,複習、檢討,wenkai,彰化縣鹿港鎮文開國小,lukang,The students go over the answers on the quiz before taking an exam.,學生在參加考試前會仔細檢查測驗的答案。,The teacher helps the students go over the answers on their quizzes.,老師幫助學生複習測驗的答案。,https://www.youtube.com/watch?v=is_HjlFocro
ozCENEcaTD4,Word of the Day: cook (v) 煮,cook (v),煮,jhutang,彰化縣竹塘鄉竹塘國小,zhutang,The students cook vegetables freshly picked from the school garden.,學生們烹調從學校菜園新鮮採摘的蔬菜。,They learn the importance of cooking locally grown vegetables.,他們了解烹飪當地種植的蔬菜的重要性。,https://www.youtube.com/watch?v=ozCENEcaTD4
HHoCQEVoP40,Word of the Day: dance routine (n) 舞蹈動作,dance routine (n),舞蹈動作,wanlai,彰化縣北斗鎮萬來國小,beidou,"The girls work very hard, rehearsing their dance routines with their instructor.",這群女孩子很認真和老師排練他們的舞步。,"Once they know the moves like the backs of their hands, the girls perform their dance routines in front of their classmates.",一旦他們將舞步練到很熟之後，他們在同學的面前表演。,https://www.youtube.com/watch?v=HHoCQEVoP40
hXlVQ5nqjBI,Word of the Day: recycling (n) 回收,recycling (n),回收,datong,彰化縣伸港鄉大同國小,shenkang,Recycling is a way to reuse materials like paper and plastic.,資源回收是將紙類和塑膠之類的材質再次回收使用。,Recycling can help take care of the planet.,資源回收有助於照顧我們的地球。,https://www.youtube.com/watch?v=hXlVQ5nqjBI
b2z_WZU0zsU,Word of the Day: mobile library (n) 行動圖書館,mobile library (n),行動圖書館,fude,彰化縣永靖鄉福德國小,yongjing,The mobile library is a truck that's been converted into a small library.,行動圖書館是由卡車改裝的小圖書館。,The mobile library can bring lots of books to students at different schools!,行動圖書館可以將書帶給不同學校的學生閱讀。,https://www.youtube.com/watch?v=b2z_WZU0zsU
-M_RfDF9Ed0,Word of the Day: school band (n) 學校樂隊,school band (n),學校樂隊,wanlai,彰化縣北斗鎮萬來國小,beidou,The school band provides music for the morning assembly.,學校樂隊為朝會儀式演奏音樂。,Students in the school band play different instruments.,學校樂隊的學生演奏不同的樂器。,https://www.youtube.com/watch?v=-M_RfDF9Ed0
cOyyv7Dj1kY,Word of the Day: shoot (v) 投籃,shoot (v),投籃,lushang,彰化縣芳苑鄉路上國小,fangyuan,The students are practicing shooting the basketball.,學生正在練習投籃。,They take turns shooting the ball.,他們輪流投籃。,https://www.youtube.com/watch?v=cOyyv7Dj1kY
mVv7i4FDyJQ,Word of the Day: reading 閱讀,reading,閱讀,taihe,彰化縣彰化市泰和國小,changhua-city,Look at the students. They’re all reading quietly.,看看這群學生，他們閱讀時多麼安靜啊！,Reading often can help you improve your vocabulary and learn many new things.,閱讀經常可以讓你增加字彙並且學到很多新知。,https://www.youtube.com/watch?v=mVv7i4FDyJQ
WmjizPN9QMY,Word of the Day: professional development 專業進修,professional development,專業進修,taihe,彰化縣彰化市泰和國小,changhua-city,"In Taiwan, all schools have professional development sessions for teachers.",在台灣，所有學校都有教師專業訓練課程。,Teachers learn new skills and strategies during their professional development sessions.,在專業訓練課程中，老師可以學到新的教學技巧與策略。,https://www.youtube.com/watch?v=WmjizPN9QMY
WcPU8nqr1Mg,Word of the Day: wash your hands 洗手,wash your hands,洗手,dayuan-puyan,彰化縣埔鹽鄉大園國小,puyan,It's important to wash your hands after using the bathroom.,上完廁所後洗手是很重要的。,Make sure to wash your hands with soap and water before eating.,確定在吃東西之前要用香皂和水來洗手。,https://www.youtube.com/watch?v=WcPU8nqr1Mg
oEg0tVNIxuo,Word of the Day: dance (v) 跳舞,dance (v),跳舞,dayuan-puyan,彰化縣埔鹽鄉大園國小,puyan,The students dance to the music.,學生們跟隨著音樂節奏跳舞。,The students dance together in class.,學生們在課堂上一起舞蹈。,https://www.youtube.com/watch?v=oEg0tVNIxuo
Gr5QYgn9Qsk,Word of the Day: professional development 專業進修,professional development,專業進修,dayuan-puyan,彰化縣埔鹽鄉大園國小,puyan,"In Taiwan, all elementary schools have professional development on Wednesday afternoons.",台灣所有小學老師在週三下午有專業進修。,Teachers learn new skills and strategies during their professional development.,老師在專業進修時學習新技能與教學策略。,https://www.youtube.com/watch?v=Gr5QYgn9Qsk
YwYbXNr-CaE,Word of the Day: ocarina (n) 陶笛,ocarina (n),陶笛,dayuan-puyan,彰化縣埔鹽鄉大園國小,puyan,These students are playing the ocarina.,這些學生正在吹陶笛。,The ocarina is a musical wind instrument.,陶笛是一種管樂器。,https://www.youtube.com/watch?v=YwYbXNr-CaE
dUwwXPoRnNM,Word of the Day: observe (v) 觀課,observe (v),觀課,cundong,彰化縣大村鄉村東國小,dacun,Some teachers are in the back of the classroom observing the class.,有些老師在教室後面觀課。,Teachers improve their teaching skills by observing others' classes.,老師藉由觀課來提昇自己的教學技巧。,https://www.youtube.com/watch?v=dUwwXPoRnNM
PklPAyDTdwo,Word of the Day: martial arts 武術,martial arts,武術,yongfeng,彰化縣福興鄉永豐國小,fuxing,The students learn martial arts outside.,學生在室外學習武術。,The instructor instructs the students in martial arts.,教練指導學生武術。,https://www.youtube.com/watch?v=PklPAyDTdwo
PKdQ0B6YM58,Word of the Day: harmonica (n) 口琴,harmonica (n),口琴,fangyuan,彰化縣芳苑鄉芳苑國小,fangyuan,The students practice the harmonica in class.,學生在課堂上練習口琴。,They play the harmonica in unison.,他們齊聲吹口琴。,https://www.youtube.com/watch?v=PKdQ0B6YM58
IaFfFL6yq44,Word of the Day: wash your hands 洗手,wash your hands,洗手,wenkai,彰化縣鹿港鎮文開國小,lukang,It's important to wash your hands after using the bathroom.,上完廁所後洗手是很重要的。,Make sure to wash your hands with soap and water before eating.,確定在吃東西之前要用香皂和水來洗手。,https://www.youtube.com/watch?v=IaFfFL6yq44
JfSLS_JR0tk,Word of the Day: correct (v) 改正,correct (v),改正,wenkai,彰化縣鹿港鎮文開國小,lukang,The teachers correct the students' work.,老師改同學的作業。,They use a red pen to correct the students' work.,他們使用紅筆來改學生的作業。,https://www.youtube.com/watch?v=JfSLS_JR0tk
kSki17syCEA,Word of the Day: test (n) 考試,test (n),考試,wenkai,彰化縣鹿港鎮文開國小,lukang,The students take tests in class.,同學們在課堂上考試。,They focus on taking their tests.,他們很專注於他們的考試。,https://www.youtube.com/watch?v=kSki17syCEA
VJMEmhmsciA,Word of the Day: earthquake drill (n) 地震演習,earthquake drill (n),地震演習,nanya,彰化縣社頭鄉湳雅國小,shetou,The students cover their heads during the earthquake drill.,在地震防災演練中，學生們用東西遮蓋頭部。,They go outside to learn more about an earthquake drill.,他們到教室外學習更多地震防災演練的知識。,https://www.youtube.com/watch?v=VJMEmhmsciA
AIaqHu4x854,Word of the Day: test (n) 考試,test (n),考試,datong,彰化縣伸港鄉大同國小,shenkang,The students are taking a test.,學生們正在考試。,Each student has to take the test independently and can’t get help from classmates.,每個學生都必須獨立參加考試，不能得到同學的幫助。,https://www.youtube.com/watch?v=AIaqHu4x854
Yx5N6kwAbRM,Word of the Day: jump rope competition 跳繩比賽,jump rope competition,跳繩比賽,hsinmin,彰化縣田中鎮新民國小,tianzhong,The students participate in a jump rope competition.,學生們參加跳繩比賽。,Many students participate in the jump rope competition.,許多學生參加跳繩比賽。,https://www.youtube.com/watch?v=Yx5N6kwAbRM
ZqXgeL7ye70,Word of the Day: shuttlecock (n) 毽子,shuttlecock (n),毽子,yuanchyuan,彰化縣二水鄉源泉國小,ershui,The kids are playing with a shuttlecock for the first time.,孩子們第一次玩毽子。,They are hitting their shuttlecock into the air and trying to catch it.,他們將毽子打向空中並試圖接住它。,https://www.youtube.com/watch?v=ZqXgeL7ye70
Xj3aXpbXCnc,Word of the Day: recycling (n) 回收,recycling (n),回收,wanlai,彰化縣北斗鎮萬來國小,beidou,Recycling is a way to reuse materials like paper and plastic.,資源回收是將紙類和塑膠之類的材質再次回收使用。,Recycling can help take care of the planet.,資源回收有助於照顧我們的地球。,https://www.youtube.com/watch?v=Xj3aXpbXCnc
xCEGHrVMko4,Word of the Day: Mother's Day cards 母親節卡片,Mother's Day cards,母親節卡片,wanlai,彰化縣北斗鎮萬來國小,beidou,These students are making Mother's Day cards for their mothers.,這些學生正在為他們的母親製作母親節卡片。,They draw pictures and put a message on their Mother's Day cards.,他們畫畫並在母親節卡片上留言。,https://www.youtube.com/watch?v=xCEGHrVMko4
j-cWRe1qJ8g,Word of the Day: CPR 心肺復甦術,CPR,心肺復甦術,wanlai,彰化縣北斗鎮萬來國小,beidou,Students are learning how to perform CPR.,學生們正在學習如何做CPR。,They use CPR manikins to practice CPR.,他們使用人體模型來練習做CPR。,https://www.youtube.com/watch?v=j-cWRe1qJ8g
82h7CNbk1UU,Word of the Day: school band (n) 學校樂隊,school band (n),學校樂隊,datong,彰化縣伸港鄉大同國小,shenkang,The school band provides music for the morning assembly.,學校樂隊為朝會儀式演奏音樂。,Students in the school band play different instruments.,學校樂隊的學生演奏不同的樂器。,https://www.youtube.com/watch?v=82h7CNbk1UU
5Rt8X10pCdo,Word of the Day: karate (n) 空手道,karate (n),空手道,wanlai,彰化縣北斗鎮萬來國小,beidou,Karate is a form of martial arts.,空手道是武術的一種形式。,The coach is teaching the moves in karate.,教練正在教空手道的動作。,https://www.youtube.com/watch?v=5Rt8X10pCdo
HOM4LMBZiyk,Word of the Day: dodgeball (n) 躲避球,dodgeball (n),躲避球,santan,彰化縣田中鎮三潭國小,tianzhong,The students are playing dodgeball.,學生們正在玩躲避球。,Dodgeball is a popular school game.,躲避球是一種流行的學校比賽。,https://www.youtube.com/watch?v=HOM4LMBZiyk
XItnjQxHFpM,Word of the Day: inflatable caterpillar (n) 充氣毛毛蟲,inflatable caterpillar (n),充氣毛毛蟲,wanlai,彰化縣北斗鎮萬來國小,beidou,Students are having fun with an inflatable caterpillar on the playground.,學生們開開心心地在操場上玩充氣毛毛蟲。,They work together to quickly move the inflatable caterpillar.,他們齊心協力，快速移動充氣毛毛蟲。,https://www.youtube.com/watch?v=XItnjQxHFpM
inftMamZwIc,Word of the Day: assemble (v) 組裝,assemble (v),組裝,sinjuang,彰化縣和美鎮新庄國小,hemei,The students assemble their robots.,學生們組裝他們的機器人。,They follow the instructions to assemble their robots.,他們按照說明組裝機器人。,https://www.youtube.com/watch?v=inftMamZwIc
Med7-VrHcfg,Word of the Day: scrape (n) 擦傷,scrape (n),擦傷,yuying,彰化縣員林市育英國小,yuanlin-city,The nurse attends to the scrape on the student's knee.,護理師處理學生膝蓋上的擦傷。,The nurse uses alcohol to clean the scrape on the student's knee.,護士用酒精清潔學生膝蓋上的擦傷。,https://www.youtube.com/watch?v=Med7-VrHcfg
6LNTGpfJWvc,Word of the Day: sing (v) 唱歌,sing (v),唱歌,yuanchyuan,彰化縣二水鄉源泉國小,ershui,The students sing the song in class.,學生們在課堂上唱歌。,The students sing along in class to the music.,學生們在課堂上跟著音樂唱歌。,https://www.youtube.com/watch?v=6LNTGpfJWvc
FKvyUYwtet0,Word of the Day: Chinese class (n) 國語課,Chinese class (n),國語課,yuanchyuan,彰化縣二水鄉源泉國小,ershui,The students are in Chinese class.,同學們正在上國語課。,They learn Chinese idioms in Chinese class.,他們在國語課學習中文的成語。,https://www.youtube.com/watch?v=FKvyUYwtet0
vTe0fMpsu_M,Word of the Day: mobile library (n) 行動圖書館,mobile library (n),行動圖書館,datong,彰化縣伸港鄉大同國小,shenkang,The mobile library is a truck that's been converted into a small library.,行動圖書館是由卡車改裝的小圖書館。,The mobile library can bring lots of books to students at different schools!,行動圖書館可以將書帶給不同學校的學生閱讀。,https://www.youtube.com/watch?v=vTe0fMpsu_M
TEDB1VnSaBQ,Word of the Day: playground (n) 遊戲場,playground (n),遊戲場,datong,彰化縣伸港鄉大同國小,shenkang,The students play different games at the school playground.,學生們在學校遊樂場上玩著不同的遊戲。,The playground has monkey bars for students to hang on.,遊樂場有攀爬架讓學生玩。.,https://www.youtube.com/watch?v=TEDB1VnSaBQ
qhtx37I5c_4,Word of the Day: playground (n) 遊戲場,playground (n),遊戲場,yuanchyuan,彰化縣二水鄉源泉國小,ershui,"The children are jumping, sliding, and climbing at the playground.",小朋友在遊樂場上跳躍、溜滑梯和爬上爬下。,The children are enjoying playing at the playground with their friends.,小朋友喜歡和朋友在遊樂場玩耍。,https://www.youtube.com/watch?v=qhtx37I5c_4
yzK1bGY2-W0,Word of the Day: correct (v) 改正,correct (v),改正,yuanchyuan,彰化縣二水鄉源泉國小,ershui,The teachers correct the students' work.,老師改同學的作業。,They use a red pen to correct the students' work.,他們使用紅筆來改學生的作業。,https://www.youtube.com/watch?v=yzK1bGY2-W0
HKLzmzYiOdA,Word of the Day: recorder (n) 直笛,recorder (n),直笛,yuanchyuan,彰化縣二水鄉源泉國小,ershui,The recorder is the first musical instrument that many students learn.,直笛是很多學生學的第一項樂器。,You can play many songs on a recorder.,你可以用直笛吹奏很多歌曲。,https://www.youtube.com/watch?v=HKLzmzYiOdA
HuqTvoG42SM,Word of the Day: table tennis (n) 桌球,table tennis (n),桌球,xishi,彰化縣福興鄉西勢國小,fuxing,The students practice playing table tennis.,學生們練習打桌球。,Table tennis is a popular sport in Taiwan.,桌球是台灣流行的運動。,https://www.youtube.com/watch?v=HuqTvoG42SM
