video_id,title,keyword,keyword_zh,school_slug,school_zh,township_slug,sentence_1,sentence_1_zh,sentence_2,sentence_2_zh,youtube
wKv5SCddvT4,Word of the Day: check out 借書,check out,借書,hsinmin,彰化縣田中鎮新民國小,tianzhong,The students check out books from the library at recess.,同學們利用下課到圖書室借書。,"After the librarian checks out the students' books, they can take them home to read.",向圖書館員辦理借閱手續後，同學們可以將書帶回家看。,https://www.youtube.com/watch?v=wKv5SCddvT4
26D-LmTbZVw,Word of the Day: Chinese yo-yo 扯鈴,Chinese yo-yo,扯鈴,sinjuang,彰化縣和美鎮新庄國小,hemei,The Chinese yo-yo is a popular toy many children enjoy.,扯鈴是很受小孩子喜歡的玩具。,The students perform tricks with Chinese yo-yos.,同學們用扯鈴表演特技。,https://www.youtube.com/watch?v=26D-LmTbZVw
1Bja8qemTeo,Word of the Day: math class 數學課,math class,數學課,hsinmin,彰化縣田中鎮新民國小,tianzhong,The students are in math class.,學生們正在上數學課。,The teacher teaches math in math class.,老師在數學課教數學。,https://www.youtube.com/watch?v=1Bja8qemTeo
V-AxM3LZc00,Word of the Day: professional development 專業進修,professional development,專業進修,sinjuang,彰化縣和美鎮新庄國小,hemei,"In Taiwan, all schools have professional development sessions for teachers.",在台灣，所有學校都有教師專業訓練課程。,Teachers learn new skills and strategies during their professional development sessions.,在專業訓練課程中，老師可以學到新的教學技巧與策略。,https://www.youtube.com/watch?v=V-AxM3LZc00
UtAbXGYgBa0,Word of the Day: cross (v) 穿越,cross (v),穿越,hsinmin,彰化縣田中鎮新民國小,tianzhong,Watch out for students crossing the road.,當心正在過馬路的學生。,Crossing guards stop traffic to let students cross the street safely.,交通導護阻擋車輛讓學生安全過馬路。,https://www.youtube.com/watch?v=UtAbXGYgBa0
sMo42R_Dwog,Word of the Day: Chinese class 國語課,Chinese class,國語課,hsinmin,彰化縣田中鎮新民國小,tianzhong,The students are in Chinese class.,同學們正在上國語課。,They learn Chinese idioms in Chinese class.,他們在國語課學習中文的成語。,https://www.youtube.com/watch?v=sMo42R_Dwog
awTCVUfwxjY,Word of the Day: sweep (v) 掃,sweep (v),掃,hsinmin,彰化縣田中鎮新民國小,tianzhong,"Every day, students sweep away fallen leaves on school grounds.",每天學生打掃校園的落葉。,"Students in Taiwan sweep the school grounds, keeping them clean and neat.",台灣的學生打掃校園，保持校園的乾淨整齊。,https://www.youtube.com/watch?v=awTCVUfwxjY
GvLxtTZy7M4,Word of the Day: professional development 專業進修,professional development,專業進修,hsinmin,彰化縣田中鎮新民國小,tianzhong,"In Taiwan, all schools have professional development sessions for teachers.",在台灣，所有學校都有教師專業訓練課程。,Teachers learn new skills and strategies during their professional development sessions.,在專業訓練課程中，老師可以學到新的教學技巧與策略。,https://www.youtube.com/watch?v=GvLxtTZy7M4
zxnBKlcAOOA,Word of the Day: earthquake drill 地震演習,earthquake drill,地震演習,xishi,彰化縣福興鄉西勢國小,fuxing,The students cover their heads during the earthquake drill.,在地震防災演練中，學生們用東西遮蓋頭部。,They go outside to learn more about an earthquake drill.,他們到教室外學習更多地震防災演練的知識。,https://www.youtube.com/watch?v=zxnBKlcAOOA
CrMSKX0pZJ8,Word of the Day: self assessment 自我評量,self assessment,自我評量,datong,彰化縣伸港鄉大同國小,shenkang,The students use tablets for self-assessment.,同學們用平板電腦做自我評量。,The tablets help the students do their self-assessment.,平板電腦讓學生可以做自我評量。,https://www.youtube.com/watch?v=CrMSKX0pZJ8
fYOVXoFqy1w,Word of the Day: calligraphy (n) 書法,calligraphy (n),書法,jhutang,彰化縣竹塘鄉竹塘國小,zhutang,The boys and girls are learning traditional Chinese calligraphy.,這群男孩和女孩正在學習中國傳統的書法。,"To get good at calligraphy, you have to have a lot of patience!",書法要寫得好必須要很有耐心。,https://www.youtube.com/watch?v=fYOVXoFqy1w
QD5cX-mMeAY,Word of the Day: weekly English 每週英語,weekly English,每週英語,fangyuan,彰化縣芳苑鄉芳苑國小,fangyuan,The school has a weekly English program.,學校有每週英語的方案。,"For the weekly English program, the students have to learn a new sentence in English.",這個方案是要學生每個禮拜學講一句英語。,https://www.youtube.com/watch?v=QD5cX-mMeAY
terwk6wL-nw,Word of the Day: exam (n) 考試,exam (n),考試,dongfang,彰化縣彰化市東芳國小,changhua-city,The students are taking an exam.,同學們正在考試。,They are working hard on their exam.,考試中他們很努力地作答。,https://www.youtube.com/watch?v=terwk6wL-nw
-N2v1iBF56w,Word of the Day: calligraphy (n) 書法,calligraphy (n),書法,dongfang,彰化縣彰化市東芳國小,changhua-city,The boys and girls are learning traditional Chinese calligraphy.,這群男孩和女孩正在學習中國傳統的書法。,"To get good at calligraphy, you have to have a lot of patience!",書法要寫得好必須要很有耐心。,https://www.youtube.com/watch?v=-N2v1iBF56w
BQ4cqa_eFEY,Word of the Day: clay (n) 黏土,clay (n),黏土,dongfang,彰化縣彰化市東芳國小,changhua-city,The students are using clay to make their own art.,同學們用黏土創作他們自己的作品。,"Clay is very soft, so the kids can mold it into different shapes.",黏土很柔軟，所以小朋友可以將它塑造成不同的形狀。,https://www.youtube.com/watch?v=BQ4cqa_eFEY
P5fhBu6nkgs,Word of the Day: eye test 視力檢查,eye test,視力檢查,jhutang,彰化縣竹塘鄉竹塘國小,zhutang,The students take an eye test in the nurse's office.,學生在護士辦公室接受視力檢查。,They take an eye test to check their vision.,他們進行視力測試來檢查他們的視力。,https://www.youtube.com/watch?v=P5fhBu6nkgs
zxjnS88JRbg,Word of the Day: calligraphy (n) 書法,calligraphy (n),書法,guangxing,彰化縣二林鎮廣興國小,erlin,The students are quietly practicing Chinese calligraphy.,同學們安靜地練習寫書法。,The calligraphy teacher is patiently instructing his students.,書法老師很有耐心地指導他的學生。,https://www.youtube.com/watch?v=zxjnS88JRbg
UrrANl9yiKU,Word of the Day: Chinese class 國語課,Chinese class,國語課,tianjhong,彰化縣田中鎮田中國小,tianzhong,The students are in Chinese class.,同學們正在上國語課。,They learn Chinese idioms in Chinese class.,他們在國語課學習中文的成語。,https://www.youtube.com/watch?v=UrrANl9yiKU
6TX1mFzyYLI,Word of the Day: correct (v) 改正,correct (v),改正,tianjhong,彰化縣田中鎮田中國小,tianzhong,The teachers correct the students' work.,老師改同學的作業。,They use a red pen to correct the students' work.,他們使用紅筆來改學生的作業。,https://www.youtube.com/watch?v=6TX1mFzyYLI
gZ9I0IOYWD0,Word of the Day: Chinese characters 國字,Chinese characters,國字,tianjhong,彰化縣田中鎮田中國小,tianzhong,The students learn Chinese characters in class.,同學們在課堂上學習國字。,They read and write Chinese characters.,他們閱讀並書寫國字。,https://www.youtube.com/watch?v=gZ9I0IOYWD0
z3bkKRNZKe8,Word of the Day: jog (v) 慢跑,jog (v),慢跑,datong,彰化縣伸港鄉大同國小,shenkang,These students are jogging around the school grounds.,這些學生正在校園裡慢跑。,Jogging is a good form of exercise.,慢跑是一種很好的運動方式。,https://www.youtube.com/watch?v=z3bkKRNZKe8
37h2dWST9SQ,Word of the Day: morning assembly 朝會,morning assembly,朝會,datong,彰化縣伸港鄉大同國小,shenkang,"Morning assembly is a meeting that administrators, teachers, and students attend every morning at school.",早會是學校行政人員、教師和學生每天早上參加的會議。,Morning assembly is a great time for staff and faculty members to share important announcements with the student body.,晨會是教職員與學生團體分享重要公告的好時機。,https://www.youtube.com/watch?v=37h2dWST9SQ
RabQYmp5DVw,Word of the Day: math class 數學課,math class,數學課,tianjhong,彰化縣田中鎮田中國小,tianzhong,The students are in math class.,學生們正在上數學課。,The teacher teaches math in math class.,老師在數學課教數學。,https://www.youtube.com/watch?v=RabQYmp5DVw
1JEjOTTaIHQ,Word of the Day: recess (n) 下課時間,recess (n),下課時間,tianjhong,彰化縣田中鎮田中國小,tianzhong,"After the bell rings for recess, most students go outside to play.",下課鈴聲響起後，大多數學生都在外面玩。,"Recess is when kids can play outside, run around, and have fun.",下課時間是孩子們可以在外面玩耍、跑來跑去、玩得開心的時候。,https://www.youtube.com/watch?v=1JEjOTTaIHQ
3OJ03rDwgVo,Word of the Day: basketball (n) 籃球,basketball (n),籃球,xishi,彰化縣福興鄉西勢國小,fuxing,The students play basketball outside.,同學們在外面打籃球。,They shoot the ball when playing basketball.,他們在打籃球的時候投籃。,https://www.youtube.com/watch?v=3OJ03rDwgVo
72gePxikoL0,Word of the Day: wash your hands 洗手,wash your hands,洗手,xishi,彰化縣福興鄉西勢國小,fuxing,It's important to wash your hands after using the bathroom.,上完廁所後洗手是很重要的。,Make sure to wash your hands with soap and water before eating.,確定在吃東西之前要用香皂和水來洗手。,https://www.youtube.com/watch?v=72gePxikoL0
Tt674RdzAAY,Word of the Day: recorder (n) 直笛,recorder (n),直笛,xishi,彰化縣福興鄉西勢國小,fuxing,The recorder is the first musical instrument that many students learn.,直笛是很多學生學的第一項樂器。,You can play many songs on a recorder.,你可以用直笛吹奏很多歌曲。,https://www.youtube.com/watch?v=Tt674RdzAAY
24bpYZsJ4jI,Word of the Day: professional development 專業進修,professional development,專業進修,xishi,彰化縣福興鄉西勢國小,fuxing,"In Taiwan, all elementary schools have professional development on Wednesday afternoons.",台灣所有小學老師在週三下午有專業進修。,Teachers learn new skills and strategies during their professional development.,老師在專業進修時學習新技能與教學策略。,https://www.youtube.com/watch?v=24bpYZsJ4jI
PMoSlmZ9UIo,Word of the Day: tee-ball 樂樂棒球,tee-ball,樂樂棒球,tianjhong,彰化縣田中鎮田中國小,tianzhong,"In tee-ball, you hit the ball with a bat.",在玩樂樂棒時，您使用球棒擊球。,"To score a point in tee-ball, the runner has to get to the home plate.",要在樂樂棒的比賽中得分，跑者必須到達本壘。,https://www.youtube.com/watch?v=PMoSlmZ9UIo
fDFdKYFo95I,Word of the Day: dance (n) 舞蹈,dance (n),舞蹈,nanya,彰化縣社頭鄉湳雅國小,shetou,The dancers teach students dance moves.,舞者教學生舞蹈動作。,The students try different dance moves.,學生們嘗試不同的舞蹈動作。,https://www.youtube.com/watch?v=fDFdKYFo95I
gACeLZNVPgo,Word of the Day: class dismissal 放學,class dismissal,放學,santan,彰化縣田中鎮三潭國小,tianzhong,The students line up outside for class dismissal.,同學們在外面排隊準備放學。,They go home after class dismissal.,他們在放學後回家。,https://www.youtube.com/watch?v=gACeLZNVPgo
UUD850mZUvI,Word of the Day: storyteller 講故事的人,storyteller,講故事的人,nanya,彰化縣社頭鄉湳雅國小,shetou,A good storyteller teaches a lesson and entertains you at the same time.,一個擅長講說故事的人可以教導大家道理，同時又兼具娛樂大眾。,The storytellers can use real or fictional information to tell a story.,說故事的人可能用真實或者是虛構的情節來說故事。,https://www.youtube.com/watch?v=UUD850mZUvI
2wda6AumsPY,Word of the Day: recorder (n) 直笛,recorder (n),直笛,nanya,彰化縣社頭鄉湳雅國小,shetou,The recorder is the first musical instrument that many students learn.,直笛是很多學生學的第一項樂器。,You can play many songs on a recorder.,你可以用直笛吹奏很多歌曲。,https://www.youtube.com/watch?v=2wda6AumsPY
YBv_4ZRMWS0,Word of the Day: online test 線上測驗,online test,線上測驗,xizhou,彰化縣溪州鄉溪州國小,xizhou,The students take online tests in class.,學生在課堂上進行線上測驗。,They use tablets to take their online tests.,他們使用平板進行線上測試。,https://www.youtube.com/watch?v=YBv_4ZRMWS0
c6x6Ug6lEOk,Word of the Day: jump rope 跳繩,jump rope,跳繩,santan,彰化縣田中鎮三潭國小,tianzhong,Jump rope is a good way to stay active and healthy.,跳繩是保持活躍和健康的好方法。,The students enjoy playing jump rope at recess.,課間休息時，學生喜歡玩跳繩。,https://www.youtube.com/watch?v=c6x6Ug6lEOk
WVXTLze45e0,Word of the Day: iPad (n) 平板,iPad (n),平板,santan,彰化縣田中鎮三潭國小,tianzhong,Some teachers have students use iPads in the class.,有些老師讓學生在課堂上使用 iPad。,"They use iPads for research, reading, and team activities.",他們使用 iPad 進行研究、閱讀和團隊活動。,https://www.youtube.com/watch?v=WVXTLze45e0
6TotMLpSvCc,Word of the Day: height (n) 身高,height (n),身高,xizhou,彰化縣溪州鄉溪州國小,xizhou,The nurse is measuring the students' heights.,護理師正在量學生的身高。,The school measures students' heights to track their growth.,學校量學生的身高來追蹤他們的成長。,https://www.youtube.com/watch?v=6TotMLpSvCc
SCjsIAWvAZ8,Word of the Day: contraption (n) 裝置,contraption (n),裝置,santan,彰化縣田中鎮三潭國小,tianzhong,The students are making different contraptions with building blocks.,學生們用積木打造不同的裝置。,They follow instructions to build their contraptions.,他們遵循指示來建造他們的裝置。,https://www.youtube.com/watch?v=SCjsIAWvAZ8
a9XHpid4R-M,Word of the Day: professional development 專業進修,professional development,專業進修,tianjhong,彰化縣田中鎮田中國小,tianzhong,"In Taiwan, all schools have professional development sessions for teachers.",在台灣，所有學校都有教師專業訓練課程。,Teachers learn new skills and strategies during their professional development sessions.,在專業訓練課程中，老師可以學到新的教學技巧與策略。,https://www.youtube.com/watch?v=a9XHpid4R-M
7g6_SuwtwMU,Word of the Day: wash your hands 洗手,wash your hands,洗手,tianjhong,彰化縣田中鎮田中國小,tianzhong,It's important to wash your hands after using the bathroom.,上完廁所後洗手是很重要的。,Make sure to wash your hands with soap and water before eating.,確定在吃東西之前要用香皂和水來洗手。,https://www.youtube.com/watch?v=7g6_SuwtwMU
wkguuA5MV08,Word of the Day: weekly English 每週英語,weekly English,每週英語,fangyuan,彰化縣芳苑鄉芳苑國小,fangyuan,The school has a weekly English program.,學校有每週英語的方案。,"For the weekly English program, the students have to learn a new sentence in English.",這個方案是要學生每個禮拜學講一句英語。,https://www.youtube.com/watch?v=wkguuA5MV08
vCtlR5c2_wE,Word of the Day: charity event 慈善活動,charity event,慈善活動,fangyuan,彰化縣芳苑鄉芳苑國小,fangyuan,The school holds a charity event.,學校舉辦慈善活動。,The students sell items during the charity event.,學生在慈善活動期間出售物品。,https://www.youtube.com/watch?v=vCtlR5c2_wE
nKNCNe0kEIE,Word of the Day: reading activity 閱讀活動,reading activity,閱讀活動,fangyuan,彰化縣芳苑鄉芳苑國小,fangyuan,The students do a reading activity in class.,學生在課堂上進行閱讀活動。,They work in groups to do a reading activity.,他們分組進行閱讀活動。,https://www.youtube.com/watch?v=nKNCNe0kEIE
FP2IvqrfFes,Word of the Day: jump rope 跳繩,jump rope,跳繩,santan,彰化縣田中鎮三潭國小,tianzhong,Jumping rope is a great form of cardio.,跳繩是一種很好的有氧運動。,"Once you get the hang of it, you can jump rope really fast!",一旦掌握了竅門，你就能跳得很快！,https://www.youtube.com/watch?v=FP2IvqrfFes
oia888G_Obo,Word of the Day: online test 線上測驗,online test,線上測驗,lushang,彰化縣芳苑鄉路上國小,fangyuan,The students take online tests in class.,學生在課堂上進行線上測驗。,The online test is in English.,線上測試以英語進行。,https://www.youtube.com/watch?v=oia888G_Obo
Q7bnnvjSjqc,Word of the Day: calligraphy (n) 書法,calligraphy (n),書法,heren,彰化縣和美鎮和仁國小,hemei,The students are quietly practicing Chinese calligraphy.,同學們安靜地練習寫書法。,The calligraphy teacher is patiently instructing her students.,書法老師很有耐心地指導她的學生。,https://www.youtube.com/watch?v=Q7bnnvjSjqc
55u2LZdimuE,Word of the Day: board game 桌遊,board game,桌遊,lushang,彰化縣芳苑鄉路上國小,fangyuan,The students form groups to play a board game.,同學們分組玩桌遊。,They enjoy playing the board game in class.,他們很喜歡在課堂上玩桌遊。,https://www.youtube.com/watch?v=55u2LZdimuE
-lRIR2Ec01k,Word of the Day: professional development 專業進修,professional development,專業進修,chaohsing,彰化縣社頭鄉朝興國小,shetou,"In Taiwan, all schools have professional development sessions for teachers.",在台灣，所有學校都有教師專業訓練課程。,Teachers learn new skills and strategies during their professional development sessions.,在專業訓練課程中，老師可以學到新的教學技巧與策略。,https://www.youtube.com/watch?v=-lRIR2Ec01k
h15RAPrM6qA,Word of the Day: spring couplet 春聯,spring couplet,春聯,heren,彰化縣和美鎮和仁國小,hemei,The students write a spring couplet in class.,同學們在課堂上寫春聯。,They use ink and brushes to write spring couplets.,他們用墨水與毛筆來寫春聯。,https://www.youtube.com/watch?v=h15RAPrM6qA
npSFmdYABX0,Word of the Day: assemble (v) 組裝,assemble (v),組裝,fangyuan,彰化縣芳苑鄉芳苑國小,fangyuan,The students assemble their robots.,學生們組裝他們的機器人。,They follow the instructions to assemble their robots.,他們按照說明組裝機器人。,https://www.youtube.com/watch?v=npSFmdYABX0
30wcBHWlH1I,Word of the Day: kindergarteners (n) 幼兒園小朋友,kindergarteners (n),幼兒園小朋友,ershui,彰化縣二水鄉二水國小,ershui,The kindergarteners sing and dance to a song.,這些幼稚園小朋友隨著歌曲又唱又跳。,The teacher leads the kindergarteners.,老師引導這一群幼稚園小朋友唱跳。,https://www.youtube.com/watch?v=30wcBHWlH1I
tpw2AzrvcTY,Word of the Day: Chinese yo yo 扯鈴,Chinese yo yo,扯鈴,ershui,彰化縣二水鄉二水國小,ershui,The Chinese yo-yo is a popular toy many children enjoy.,扯鈴是很受小孩子喜歡的玩具。,The students perform tricks with Chinese yo-yos.,同學們用扯鈴表演特技。,https://www.youtube.com/watch?v=tpw2AzrvcTY
CxuVgAgB9Z0,Word of the Day: jump rope competition 跳繩比賽,jump rope competition,跳繩比賽,nanya,彰化縣社頭鄉湳雅國小,shetou,The students participate in a jump rope competition.,學生們參加跳繩比賽。,Many students participate in the jump rope competition.,許多學生參加跳繩比賽。,https://www.youtube.com/watch?v=CxuVgAgB9Z0
HzqjhZbzkaM,Word of the Day: spring couplet 春聯,spring couplet,春聯,ershui,彰化縣二水鄉二水國小,ershui,The students write a spring couplet in class.,學生們在課堂上寫春聯。,They use ink and brushes to write spring couplets.,他們使用毛筆和墨水來寫春聯。,https://www.youtube.com/watch?v=HzqjhZbzkaM
ivpb6SJ_hzo,Word of the Day: cross (v) 穿越,cross (v),穿越,yuanchyuan,彰化縣二水鄉源泉國小,ershui,Watch out for students crossing the road.,當心正在過馬路的學生。,Crossing guards stop traffic to let students cross the street safely.,交通導護阻擋車輛讓學生安全過馬路。,https://www.youtube.com/watch?v=ivpb6SJ_hzo
GffYApYSuOg,Word of the Day: shoot (v) 投籃,shoot (v),投籃,shingang,彰化縣伸港鄉新港國小,shenkang,The students are practicing shooting the basketball.,學生正在練習投籃。,They take turns shooting the ball.,他們輪流投籃。,https://www.youtube.com/watch?v=GffYApYSuOg
BcHBhkD8vh8,Word of the Day: color (n) 顏色,color (n),顏色,shingang,彰化縣伸港鄉新港國小,shenkang,Some pieces of art aren't finished until the artist has added color.,有些藝術作品必須等藝術家上好顏色才算完成。,These students are using markers and colored pencils to add color to their drawings.,這些學生用馬克筆與色鉛筆來為他們的圖畫上顏色。,https://www.youtube.com/watch?v=BcHBhkD8vh8
gcgm1X44QGI,Word of the Day: hot pot 火鍋,hot pot,火鍋,yuying,彰化縣員林市育英國小,yuanlin-city,The students make hot pot for lunch.,同學們煮火鍋作為他們的午餐。,They add many different ingredients to their hot pot.,他們加了很多不同料到火鍋當中。,https://www.youtube.com/watch?v=gcgm1X44QGI
D4zhVpMVdiE,Word of the Day: sweep (v) 掃,sweep (v),掃,yuanchyuan,彰化縣二水鄉源泉國小,ershui,"Every day, students sweep away fallen leaves on school grounds.",每天學生打掃校園的落葉。,"Students in Taiwan sweep the school grounds, keeping them clean and neat.",台灣的學生打掃校園，保持校園的乾淨整齊。,https://www.youtube.com/watch?v=D4zhVpMVdiE
EepekQTrQvA,Word of the Day: calligraphy (n) 書法,calligraphy (n),書法,yuanchyuan,彰化縣二水鄉源泉國小,ershui,The students are quietly practicing Chinese calligraphy.,同學們安靜地練習寫書法。,The calligraphy teacher is patiently instructing her students.,書法老師很有耐心地指導她的學生。,https://www.youtube.com/watch?v=EepekQTrQvA
g2AfCFYlXE4,Word of the Day: ocarina (n) 陶笛,ocarina (n),陶笛,yuanchyuan,彰化縣二水鄉源泉國小,ershui,These students are playing the ocarina.,這些學生正在吹陶笛。,The ocarina is a musical wind instrument.,陶笛是一種管樂器。,https://www.youtube.com/watch?v=g2AfCFYlXE4
JKXXibUqjv0,Word of the Day: iPad (n) 平板,iPad (n),平板,yuanchyuan,彰化縣二水鄉源泉國小,ershui,Some teachers have students use iPads in the class.,有些老師讓學生在課堂上使用 iPad。,"They use iPads for research, reading, and team activities.",他們使用 iPad 進行研究、閱讀和團隊活動。,https://www.youtube.com/watch?v=JKXXibUqjv0
FDOmTXjiR6E,Word of the Day: dance 跳舞,dance,跳舞,lushang,彰化縣芳苑鄉路上國小,fangyuan,The students dance to the music.,同學們隨著音樂節奏跳舞。,The students dance together in class.,同學們在班上一起跳舞。,https://www.youtube.com/watch?v=FDOmTXjiR6E
kQE_hV4nZIc,Word of the Day: award (n) 獎,award (n),獎,yuanchyuan,彰化縣二水鄉源泉國小,ershui,Each student receives an award.,每個學生都接受頒獎。,The principal gives each student their award.,校長頒發獎項給每個小朋友。,https://www.youtube.com/watch?v=kQE_hV4nZIc
cpCLqnOmv_A,Word of the Day: basketball practice 籃球練習,basketball practice,籃球練習,yuying,彰化縣員林市育英國小,yuanlin-city,The students are outside for basketball practice.,同學們在外面做籃球訓練。,They work hard during basketball practice.,他們非常認真地做籃球訓練。,https://www.youtube.com/watch?v=cpCLqnOmv_A
bkMvXwEPDvE,Word of the Day: serve (v) 打菜,serve (v),打菜,shingang,彰化縣伸港鄉新港國小,shenkang,The students serve lunch to their classmates.,學生為同學打菜。,The task of serving changes every week.,打菜的工作每週輪替一次。,https://www.youtube.com/watch?v=bkMvXwEPDvE
L9HSnWWGJFk,Word of the Day: slide (n) 溜滑梯,slide (n),溜滑梯,lushang,彰化縣芳苑鄉路上國小,fangyuan,The students play on the slide.,學生們在玩溜滑梯。,They take turns going down the slide.,他們輪流滑下溜滑梯。,https://www.youtube.com/watch?v=L9HSnWWGJFk
-75jzO17Is4,Word of the Day: school lunch 營養午餐,school lunch,營養午餐,shingang,彰化縣伸港鄉新港國小,shenkang,School lunch is eaten in the classroom in Taiwan.,台灣的學校午餐是在教室裡吃的。,School lunch is designed to be healthy.,學校午餐主旨在健康。,https://www.youtube.com/watch?v=-75jzO17Is4
JfAqeg9rBSo,Word of the Day: jump rope 跳繩,jump rope,跳繩,shingang,彰化縣伸港鄉新港國小,shenkang,Jumping rope is a great form of cardio.,跳繩是一種很好的有氧運動。,"Once you get the hang of it, you can jump rope really fast!",一旦掌握了竅門，你就能跳得很快！,https://www.youtube.com/watch?v=JfAqeg9rBSo
nkTziNE0-zg,Word of the Day: draw (v) 畫,draw (v),畫,shingang,彰化縣伸港鄉新港國小,shenkang,"The students are using pencils, colored pencils, and markers to draw in class.",學生們正在使用鉛筆、彩色鉛筆和記號筆在課堂上作畫。,Drawing is a fun way to improve your artistic ability!,繪畫是一種提高藝術能力的有趣方式！,https://www.youtube.com/watch?v=nkTziNE0-zg
